song,artist,lyrics
ms. chocolate, lil jon, (yeah!) aye uh huh (let's go ladies!) uh huh lil jon (yeah!) your boy kells (yeah!) this is for the chocolate girls all around the world (let's go) uh every block (yeah!) every club (yeah!) every hood (yeah!) i'm in love  so sweet so round so thick so nasty ooh i love that shit so smooth so creamy goddamn it i must be dreaming so jiggly so soft goddamn it i wanna break you off so hot you 'gon melt eat you all up by myself girl i can't wait to unwrap ya it's a chocolate fix i'm after so tasty my treat miss chocolate let me get a little piece i'm cuckoo for cocoa so good i want me some more i'm caught up i need to stop it goddamn i love you miss chocolate!  talking to my silky smooth dark skin chocolate women independent this is y'alls anthem i like them light skinned girls but that dark skin i love chocolate girls stand up this is y'alls anthem  talking about hips talking about thighs talking about big ol' booties and brown eyes chocolate that's what i gotta have tonight leave up out the club with two tonight take shots then more shots then we drink like we own the bar and she's pushing that all on me conversation like let's just leave and i don't hesitate (no) to the crib right away she dropping it dropping it that chocolate chocolate  talking to my silky smooth dark skin chocolate women independent this is y'alls anthem i like them light skinned girls but that dark skin i love chocolate girls stand up this is y'alls anthem  had a red bone chick before she don't do it like you do so i know what i want tonight fly on a chocolate high baby girl you're thick in all the right places let me lick that chocolate baby i wanna taste it think i'm in love (with your dark skin) said i'm in love with miss chocolate!  talking to my silky smooth dark skin chocolate women independent this is y'alls anthem i like them light skinned girls but that dark skin i love chocolate girls stand up this is y'alls anthem  oh i gotta have that dark chocolate (can you give it to me give it to me?) tonight i wanna taste (oh yeah) that dark chocolate (can you give it to me give it to me?) in my bed i gotta have (ooh give it to me give it to me) that dark chocolate oh oh (aye) oh oh let me hear the chocolate ladies say aye yo! (aye yo...) ay ay ay ay ay ay ay yay aye yo! (aye yooo oh) ay ay ay ay ay ay ay ay ay  this is y'alls anthem
g walk, lil jon, lil jon! (bme click) soulja boy tell 'em (can we crank these niggas up boy? let's crank these niggas up man! hahahahaha) sod money gang lame niggas get the fuck outta my way when i step in the club on this one right here nigga (fuck nigga!) shawty redd!  let me see you throw your motherfuckin' sets up (in the sky) throw your motherfucking rags out (wave em' high) pussy nigga keep on eying me (you wanna die) i got shawties them in here too (they gonna ride) we too crunk to be tryna dance (i got that thang) and it's right here on my side (don't make me bang) you must not know where the fuck we from (pick a side) eastside to the west nigga (and we don't hide)  g walkin' through the club haters gettin' mugs i gave your bitch a hug and she got wetter than a tub i'm hot nigga (i'm hot nigga) g walkin' on yo block nigga 80 stacks spent tell my jeweler make my watch bigger soulja boy blowin' up like a fuckin' bomb all i need is ten minutes in a club with lil jon got my goons in this bitch so shawty don't test yo luck chairs flyin' in the club quack quack bitch you better duck  swag to the left (left) swag to the right (right) soulja boy and lil jon gettin' crunk all night g walkin' with the realest with some pants on now everybody in the club turn your motherfuckin' swag on g walk (walk) do it! (walk g walk nigga walk walk gangsta walk nigga) g walk (walk) do it! (walk g walk nigga walk walk gangsta walk nigga)  i'm not playin' boy i'm not playin' ho fuck swag bitch i got mojo no homo i got them thangs cocked 25 bands all wrapped in one not soulja boy shawty left arm right arm shawty 27 tattoos shawty walk inside the party polo on my body g walkin' all my goons get retarded (look)  i don't give a fuck yeah that's what's up think you too tough? you get touched up i sent a ho on ya you get sucked up she let them goons in that's how you've fucked up but it don't even matter fuck that chitter-chatter i'm in the club with it i make them niggas splatter i shake them bottles up we let that liquor splatter cause i'm a crunk nigga i ain't no fuckin' rapper  swag to the left (left) swag to the right (right) soulja boy and lil jon gettin' crunk all night g walkin' with the realest with some pants on now everybody in the club turn your motherfuckin' swag on g walk (walk) do it! (walk g walk nigga walk walk gangsta walk nigga) g walk (walk) do it! (walk g walk nigga walk walk gangsta walk nigga)  hey hey hey hey hey hey hey hey hey hey hey hey hey hey hey hey hey hey hey hey hey hey hey hey hey hey hey hey hey hey hey hey
work it out, lil jon, we back again (hey!) chico what’s up boy? (como?) the ladies said it ain’t enough songs for them to dance to (what?) let’s make ‘em dance  the king is here shake yo ass ay mi madre todo eso culo shake yo ass entonces dale the king is here shake yo ass ay mi madre todo eso culo shake yo ass entonces dale  go ‘head girl work it out (sexy girl) go ‘head girl work it out (dale loca) go ‘head girl work it out (sexy girl) go ‘head girl work it out (dale loca) go ‘head girl work it out (work it out) go ‘head girl work it out (work it out) go ‘head girl work it out (work it out) go ‘head girl work it out  so so sexy (sexy) so so fine (fine) so so feisty (feisty) let me see you whine so so kinky (kinky) so so freaky (freaky) so so naughty (naughty) such a good time do that nasty dance let me see ya work shake it up girl till your hips hurt make that thang hard make that booty drop whip your body hard shake it don’t stop!  go ‘head girl work it out (sexy girl) go ‘head girl work it out (dale loca) go ‘head girl work it out (sexy girl) go ‘head girl work it out (dale loca) go ‘head girl work it out (work it out) go ‘head girl work it out (work it out) go ‘head girl work it out (work it out) go ‘head girl work it out  pit i was ready for a little bit a foreplay for sho’ oh-k-k-k (dale) baby say you wanna open up a pandora box she say “si si” (dale) love on the street like yeah oh yeah i’m a freak like that (dale) and i ain’t fair but if it’s fair then yeah i’ll eat like that (dale) i’mma roll with things you can’t even imagine or even fathom (dale) and i ain’t got no fan but once i hit i’m gone i’m phantom (dale) baby you’re my eve he’s your adam and i’m your snake (dale) so here’s your apple wanna play chess? check mate  go ‘head girl work it out (sexy girl) go ‘head girl work it out (dale loca) go ‘head girl work it out (sexy girl) go ‘head girl work it out (dale loca) go ‘head girl work it out (work it out) go ‘head girl work it out (work it out) go ‘head girl work it out (work it out) go ‘head girl work it out  break that shit down (dale) break that thang down (dale) break that shit down (dale) break that thang down (dale) break that shit down (dale) break that thang down (dale) break that shit down (dale) break that thang down (woooo) let me see ya work (go go!) let me see ya work (go go!) let me see ya work (go go!) let me see ya work (go go!) let me see ya work (go go!) let me see ya work (go go!) let me see ya work (go go!) let me see ya work (work work work)  go ‘head girl work it out (sexy girl) go ‘head girl work it out (dale loca) go ‘head girl work it out (sexy girl) go ‘head girl work it out (dale loca) go ‘head girl work it out (work it out) go ‘head girl work it out (work it out) go ‘head girl work it out (work it out) go ‘head girl work it out  the king is here shake yo ass ay mi madre todo eso culo shake yo ass entonces dale the king is here shake yo ass ay mi madre todo eso culo shake yo ass entonces dale  let me see ya work (work work work work work work work work!)
drink, lil jon, yeah hey yeah hey yeah hey time to have some drinks (drinks drinks drinks drinks) lil jon lmfao baby we came in the club (yeah) to get real fucked up and motherfuckin' party how about you? let's go!  one shot two shot three shot four take the bottle to the head and one fucking more one shot two shot three shot four take the bottle to the head and one fucking more everybody drink drink drink drink drink drink drink hey drink drink drink drink drink drink drink everybody drink drink drink drink drink drink drink hey drink drink drink drink drink drink drink  everybody pour me another one hey pour me another one hey pour me another one hey pour me another one pour me another one hey pour me another one hey pour me another one hey pour me another one  champagne vodka don julio tequila let's drink it all and get this party off the meter hey ain't no saying no (no) no your ass needs a drink (drink) i don' drink so much i can't even fucking think yeah damn this party jumpin' the bass is really bumpin' i see a little hottie i need to tell her something yeah you're looking sexy in your all pink stop being lame and have a fucking drink let's go  one shot two shot three shot four take the bottle to the head and one fucking more one shot two shot three shot four take the bottle to the head and one fucking more everybody drink drink drink drink drink drink drink hey drink drink drink drink drink drink drink everybody drink drink drink drink drink drink drink hey drink drink drink drink drink drink drink  everybody pour me another one hey pour me another one hey pour me another one hey pour me another one pour me another one hey pour me another one hey pour me another one hey pour me another one  first off i'ma pro at this i walk in the club with the coldest bitch straighten up you better focus bitch my glass's half empty pour some shit the matter of fact go ahead and drink that couple more shots yeah where your freak at i peep that now i need that treat your pussy like a record go ahead and leak that  it's red foo that dude up in the place party rock crew we doin' it by the case champagne is like a player's mace when the girl's act naughty we spray 'em up in the face yeah it feels like college i'll be the dude walking around with the beer goggles we surrounded by models cause it looks like 4th of july when they bring them bottles  one shot two shot three shot four take the bottle to the head and one fucking more one shot two shot three shot four take the bottle to the head and one fucking more everybody drink drink drink drink drink drink drink hey drink drink drink drink drink drink drink everybody drink drink drink drink drink drink drink hey drink drink drink drink drink drink drink  everybody pour me another one hey pour me another one hey pour me another one hey pour me another one pour me another one hey pour me another one hey pour me another one hey pour me another one  everybody drink drink drink drink drink drink drink hey drink drink drink drink drink drink drink everybody drink drink drink drink drink drink drink hey drink drink drink drink pour me another one
every freakin night, lil jon, you're friends are right its jodeci but the song is called freak'n you i wanna freak you everytime i close my eyes i wake up feelin' so horny i can't get you outta my mind sexin' you be all i see i would give anything just to make you understand me i don't give a damn about nothing else freek'n you is all i see tonight i need your body tonight you got my time tonight you won't be sorry tonight you got my mind you got my mind all i wanna do is freak you what must i say what must i do to show how much i think about freek'n you what must i say what must i do to show how much i think about freek'n you oooh i could go on for days but i couldn't go on for weeks i can even play with another body but it wouldn't last 'cause i'm a freak turned on by everything you say i'm turned on by everything you do and at night when i close my eyes i only dream of freek'n you tonight i need your body tonight you got my time tonight you won't be sorry tonight you got my mind ] what must i say what must i do to show how much i think about freek'n you what must i say what must i do to show how much i think about freek'n you oooh i could go on for days but i couldn't go on for weeks i can even play with another body but it wouldn't last 'cause i'm a freak turned on by everything you say i'm turned on by everything you do and at night when i close my eyes i only dream of freek'n you tonight i need your body tonight you got my time tonight you won't be sorry tonight you got my mind what must i say what must i do to show how much i think about freek'n you what must i say what must i do to show how much i think about freek'n you freek out and freek me up and down devante swing freek out and freek me up and down freek out and freek me up and down every freek'n night and every freek'n day i wanna freek you baby in every freek'n way every freek'n day every freek'n night i wanna freek you girl your body's so freek'n tight every freek'n night and every freek'n day i wanna freek you baby in every freek'n way every freek'n day every freek'n night i wanna freek you girl your body's so freek'n tight what must i say what must i do to show how much i think about freek'n you what must i say what must i do to show how much i think about freek'n you what must i say what must i do to show how much i think about freek'n you i think about freek'n you i wanna freek you
get loose, lil jon, time get loose time get loose time get loose time get loose time get loose time get loose time get loose time get loose time get loose time get loose  fuck that shit it's time get loose fuck that shit it's time get loose fuck that shit it's time get loose fuck that shit it's time get loose  time get loose time get loose time get loose time get loose time get loose time get loose time get loose time get loose time get loose time get loose  fuck that shit it's time get loose fuck that shit it's time get loose fuck that shit it's time get loose fuck that shit it's time get loose
ooh big momma, lil jon, yeah (yeah) yeah (yeah) yeah (yeah) yeah (yeah) yeah (yeah) yeah (yeah) yeah (yeah) yeah (yeah) yeah (yeah) yeah (yeah) lil' jon and them eastside boyz alright alright talkin' bout big momma big momma big momma [hook x16 go big momma! go ahead go ahead  uh uh uh uh ooh ah let's begin big momma comin' through better tell your friends what that south like that good country cookin' all day and night she might be big but she can still go to the dance flo' to the back of our co' hey don't talk no junk ya might get skunked with a mother gun huh if ya wanna fight big momma knock ya out with one aight it's all to the good cause nobody watchin' over our neighborhood but wait a minute i came to get with sherry or bennett cause she so cute and i love it when she wear them daisy dukes  go big momma! go ahead go ahead  i was at a jam the other night seen big momma she was lookin' tight iced out grill in her mouth flake in her hair representin' that south on the floor she was shakin' that thang poppin' that thang damn twerkin' that thang big momma off the chain she will show ya know shame cause she true to the game and ya know she serious and the way she bounce got a playa delirious and i know she ready gotta dance so crunk even though she heafty and when we left the club i seen big momma's caddy sittin' on them dubs and the trunk with the block beater i was sittin' right behind her in the two-seater  go big momma! what what  ooh look at big momma ooh big mama! big momma droppin' that thang ooh big mama! big momma big and beautiful ooh big mama! look at big momma with them daisy dukes ooh big mama! big momma got on some jammies ooh big mama! big momma what chu' talkin' bout ooh big mama! big momma done gone off the top ooh big mama! big momma you scare me ooh big mama!  go big momma! go ahead go ahead go ahead! (repeated to fade)
give it all u got, lil jon, yeah! i don't care what time it ? whats up? i'm gonna keep partyin' lets do it! i'm gonna give it all i got (oh me too) so i need to see you doin' the same thing!  we'll party party p-party you know we're never sober once we step on the floor you know we take it over hands up in the air we on a roller coaster oh oh oh  ladies to the dance floor ladies to the dance floor ladies to the dance floor ladies to the dance floor ladies to the dance floor ladies to the dance floor ladies to the dance floor ladies to the dance floor  one night to live (so we live it up) then we do that damn thing (then we give it up) gimme any kind of shot (then i drink it up) gone hit the dance floor girl (heat it up) hands up reach to the sky (put em up!) get crazy in the club (lets tear it up!) don't wanna stop till the sun come up we gone party every day we don't give a what ladies lookin' like super models everybody's over here poppin' bottles drink it up full throttle fiesta like there's no tomorrow!  we'll party party p-party you know we're never sober once we step on the floor you know we take it over hands up in the air we on a roller coaster oh oh oh crank it up don't stop you can give it all you got let's rock don't stop you can give it all you got at the top top top you can give it all you got oh oh oh  twist and turn let your body rock lose control lets your hips pop beats so hard make your heart stop drink until your body drops start the fire let it blaze let your animal out the cage get wild and crazy lets behave ? ? anytime anywhere we gone (do it up) we gone party all night i don't give a what ?  we'll party party p-party you know we're never sober once we step on the floor you know we take it over hands up in the air we on a roller coaster oh oh oh crank it up don't stop you can give it all you got lets rock don't stop you can give it all you got at the top top top you can give it all you got oh oh oh all the ladies song along now! oh oh oh oh oh oh oh oh oh oh oh oh oh oh oh  we'll party party p-party you know we're never sober once we step on the floor you know we take it over hands up in the air we on a roller coaster oh oh oh crank it up don't stop you can give it all you got lets rock don't stop you can give it all you got at the top top top you can give it all you got oh oh oh we'll party party p-party you know we're never sober once we step on the floor you know we take it over hands up in the air we on a roller coaster oh oh oh crank it up don't stop you can give it all you got lets rock don't stop you can give it all you got at the top top top you can give it all you got oh oh oh
fall out, lil jon, yeaaaaaah! lil jon! (lil jon!) travis porter! (travis porter bitch!) fall out (fall out) fall out (fall out) yeah! yeah!  pull up in the mall all the hoes (fall out) cars so damn tall open the doors (fall out) money money money just to blow (fall out) we on fire fire fire these niggas cold  i tint my screen (fall out fall out) i sip my lean (fall out fall out) i tint my screen (fall out fall out) i sip my lean (fall out fall out) i tint my screen (fall out fall out) i sip my lean (fall out fall out) i tint my screen (fall out fall out) i sip my lean (fall out fall out)  mug a nigga middle finger to these bitches (what what) fuck you hoes first  snitches (what what) yeah i'm back and i'm still up on that crunk shit (yeah) fuck the dumb shit you be on that mugging shit (what) where you been nigga? i've been getting guap guap out of town overseas making pussy pop (hey) them hoes jumped down (yeah) when i jumped out (yeah) so i pulled my cock out and let her rock out  smashed hoe turnt up all the way i don't see her turn up all the way all on in my song drinking it to a loan blind eye i just want to  swear to god boy i'm bout to beat you better tell 'em 9 millimeters that's why i'm finna bless 'em 5 4 3 2 1 leggo 9 to 5 boat but i'm finna go catch my tv file tv boss all them hoes 'gon fall out (fall out) his cost miles but my cost taller open the door and fall out (fall out) and what the hell is yall talkin bout? strap da fool fool i'm on fire fire fire (fool fool)  pull up in the mall all the hoes (fall out) cars so damn tall open the doors (fall out) money money money just to blow (fall out) we on fire fire fire these niggas cold  i tint my screen (fall out fall out) i sip my lean (fall out fall out) i tint my screen (fall out fall out) i sip my lean (fall out fall out) i tint my screen (fall out fall out) i sip my lean (fall out fall out) i tint my screen (fall out fall out) i sip my lean (fall out fall out)  aw hey get wet it's travis porter and lil jon when i'm down south i say bruh when i'm on north i say son and everytime we out of town we got goons don't mean no gut aye pull up in the club this song real small two dos cuz a nigga we stunt (ah!) and yesterday i looked for  ball out ran into this chick she was starstruck bout to fall out i might just pull up at her house beat it down and just haul out she say ali that's all you got? yeah yeah bitch i'm all out  (quez!) awwww sound the alarm because i'm in the airport and he calling me the bomb and the way a nigga ball they be calling me lebron tried to rob me he was dead he tried to stab me with a gun (what?) like lil jon and since this k.e.b i'm just 'gon rip this shit and run we in the league and you in the back like baby seats when we hit the club and ball yall just fall out just like some baby teeth (oh!)  pull up in the mall all the hoes (fall out) cars so damn tall open the doors (fall out) money money money just to blow (fall out) we on fire fire fire these niggas cold  i tint my screen (fall out fall out) i sip my lean (fall out fall out) i tint my screen (fall out fall out) i sip my lean (fall out fall out) i tint my screen (fall out fall out) i sip my lean (fall out fall out) i tint my screen (fall out fall out) i sip my lean (fall out fall out)
on de grind, lil jon, we stay on the grind all day and night we tired of suffering
i do, lil jon, (lyrics are not fully completed)  let's get em nigga (hey) lil jon yeah crunk shit!! swizzy i need everybody to get the drinks up like this and spray them all over the place and we be crazy tonight! yeah bme click i represent for the us nigga i represent germany nigga i represent nigga asia (yes) uk (owwwww)  do anybody representin anymore? hu do anybody representin anymore? hu hey! i do (i do) i do (i do) i do (i do) i do (i do) hey do anybody representin anymore? hu do anybody representin anymore? hu hey! i do (i do) i do (i do) i do (i do) i do (i do) hey  rep yo city rep yo town rep yo hood bouncin around the club throw it up its all good standin on the table standin on the chair shake yo dreads up smack em in the airrr pussy muhfucka get chyo pussy ass crunk tell that bottom nigga get chyo pussy ass drunk fucka nigga muthnigga fucka nigga hatin  do anybody representin anymore? hu do anybody representin anymore? hu (hey! i do (i do) i do (i do) i do (i do) i do (i do) hey) do anybody representin anymore? hu do anybody representin anymore? hu (hey! i do (i do) i do (i do) i do (i do) i do (i do) hey)   sick nigga!  do anybody representin anymore? hu do anybody representin anymore? hu (hey! i do (i do) i do (i do) i do (i do) i do (i do) hey) do anybody representin anymore? hu do anybody representin anymore? hu (hey! i do (i do) i do (i do) i do (i do) i do (i do) hey)  hands up that's wassup i don't really give a what jump up on that table like you really don't give a what my drink my bar boy this my sportscar a million bucks  why i'm a rockstar she bouncing bouncing he riding he riding we in the club we rowdy rowdy  do anybody representin anymore? hu do anybody representin anymore? hu hey! i do (i do) i do (i do) i do (i do) i do (i do) hey do anybody representin anymore? hu do anybody representin anymore? hu (hey! i do (i do) i do (i do) i do (i do) i do (i do) hey)
