song,artist,lyrics
take it off (spanglish version), lil jon, i can feel your eyes on me keep on watching i can't hear a word you speak so no talking ya le dije al dj que me suba la music hoy lo voy a mover que me apagen las luces  con calma no pierdas la calma (mami) me baila y solita se alarma (mami) muévelo (wild out let your freak out) báilalo (let loose get crazy mami) muévelo (keep dancing make ya body sweat) báilalo (too hot you can take it off)  hey the way you move your body got me so turnt up like hey so sexy got me caught up in the moment like hey keep playing you gon' wake up in the morning like hey que me tiene al borde de la locura  quitatelo (take it off) ese mahon la camisa también nena quitatelo (take it off) que aquí no hay nadie quiero verte bien nena quitatelo (take it off) que yo quiero ver tu meneo cintura tanta hermosura tanta figura que me tiene al borde de la locura  i can feel your eyes on me keep on watching i can't hear a word you speak so no talking ya le dije al dj que me suba la music hoy lo voy a mover que me apagen las luces  con calma no pierdas la calma (mami) me baila y solita se alarma (mami) muévelo (wild out let your freak out) báilalo (let loose get crazy mami) muévelo (keep dancing make ya body sweat) báilalo (too hot you can take it off)  hey back it up on me any closer i'mma be like hey all up in your ear tell you what you wanna hear like hey i'm looking at you booty looking at me like hey tell the valet to bring me my keys  sigue como vas jugando y ya mismo me encuentras no me digas nada cuando te agarre en la oscuridad el fuego que andas causando tienes que apagar no te puedes ir corriendo te agarro sola y tienes que trabajar  quitatelo (take it off) ese mahon la camisa también nena quitatelo (take it off) que aquí no hay nadie quiero verte bien nena quitatelo (take it off) que yo quiero ver tu meneo cintura tanta hermosura tanta figura que me tiene al borde de la locura  i came to the party to find me a papi i hope you can handle a woman like me with a mind and a body salgo en el ferrari y me encuentro una mami que quiere que yo me le pegue que la noche entera me entregue  i can feel your eyes on me keep on watching i can't hear a word you speak so no talking ya le dije al dj que me suba la music hoy lo voy a mover que me apagen las luces   con calma no pierdas la calma (mami) me baila y solita se alarma (mami) muévelo (wild out let your freak out) báilalo (let loose get crazy mami) muévelo (keep dancing make ya body sweat) báilalo (too hot you can take it off)  quitatelo (take it off) ese mahon la camisa también nena quitatelo (take it off) que aquí no hay nadie quiero verte bien nena quitatelo (take it off) que yo quiero verte tu meneo de cintura tanta hermosura tanta finura que me tiene al borde de la locura
what a night, lil jon, i was lost i was frozen walking down the streets alone when i saw this place was open tonight and the girls they were rocking and the alcohol was flowing and i knew right away this was my life oh what a night oh what a night oh what a night  feels so good (so good) feels so right (so right) let's make a toast (make a toast) to the night (to the night) it's gonna get crazy (crazy) so hold on tight (on tight) let's have a ball (ball) live your life (life) let it go (let it go) let it loose (let it loose) release it all (release it all) no excuse (cuse) have no cares (no cares) have no fears (have no fears) let's act a fool (act a fool) up in here (hey)  i was lost (lost) i was frozen (frozen) walking down the streets alone when (yeah) i saw this place was open (what) tonight (hey hey hey ) and the girls (girls) they were rocking (rocking) and the alcohol was flowing (yeah) and i knew right away this was my life  put your f*ing hands up oh what a night night night night night night night night night  a lot of smoking a lot of drinking a lot of singing a lot of dancing a lot of freaking a lot of women a lot of kissing a lot of sinning  i was lost i was frozen walking down the streets alone when i saw this place was open tonight and the girls they were rocking and the alcohol was flowing and i knew right away this was my life oh what a night oh what a night oh what a night lil jon what a night claude kelly night (repeats till end of song)
crunk rock (intro), lil jon, it's time motherfuckers! it's time to get motherfucking crunk! if you didn't come to get crunk get the fuck out the club! if you came to get crunk put yo fucking hands up! let's do it! can i get a yeah? (yeah!) can i get a yeah? (yeah!) can i get a what? (what?) can i get a what? (what?) well let me get an okay! (okay!) crunk rock!
what is crunk rock? (interlude), lil jon, what the fuck is crunk rock? crunk rock is more than just some goddamn music crunk rock is a motherfucking lifestyle we live life to the fullest we don't let nobody tell us we can't do shit we party like rockstars we crunk all the motherfucking time we live for today and not for tomorrow if a nigga act the fuck up we fuck his ass up!
summer en france (feat. naadei), lil jon, hey hey it might not be hot where i’m at but i can go where the sun is shining let’s go let’s go i love this summer time whoa j’irai la ou est le soleil de ma plus rien se …parle j’oulirais le temp et je dance je dance je dance whoa j’irai la ou est le soleil de ma plus rien se …parle j’oulirais le temp et je dance je dance je dance i wanna be gone where the sun is always shining take a break from work take a break from grinding get crazy not even thinking get loose and do a lot of drinking this party ladies everywhere we get them drunk and people start to stare living life we have no cares this is too much fair yeah it ain’t even fair now … the magic potion… i keep the ladies smiling but i ain’t smiling we in saint-tropez and we whacking show taking shots on biggy yachts whoa j’irai la ou est le soleil de ma plus rien se …parle j’oulirais le temp et je dance je dance je dance whoa j’irai la ou est le soleil de ma plus rien se …parle j’oulirais le temp et je dance je dance je dance i love the summer time i love when it gets hot i love the outside i love the …top women looking sexy sweats and …tops we gonn party hard we will never stop sun’s great sun’s great hand … long day that never end yeah partying all night what? break of dawn we won’t stop what? keep on going whoa j’irai la ou est le soleil de ma plus rien se …parle j’oulirais le temp et je dance je dance je dance whoa j’irai la ou est le soleil de ma plus rien se …parle j’oulirais le temp et je dance je dance je dance x 4
rager day, lil jon, it’s not friday it’s not saturday do you know what fucking day is? it’s rager day! raise! it’s not friday it’s not saturday do you know what fucking day is? it’s rager day! raise!
athen_jbf, lil jon, ¨ikke vores billede sry kan ikke ændre det¨ lil qwel på beat lil boss lil jon på det mic  sidder med min pige (yeah) flower på det beat (yeah) sipper på min lean sipper på min lean (yeah) mig og mine drenge leder efter en pige hvor min queen vi så blæst i athen  sidder med min pige (yeah) flower på det beat (yeah) sipper på min lean sipper på min lean (yeah) mig og mine drenge leder efter en pige hvor min queen vi så blæst i athen  vi så blæst i athen lig nu helt væk kan ik finde mig selv lige nu vi puller altid op i en sindsyg coupe hey du tror stor men hvem fuck er du?  vi så iced out der er ingen der kan nå mig now min producer hedder lil clout ingen doubt lil qwel får det til at lyde godt  legenden hedder lil qwel du kan aldrig finde ham i en fængsel cell lissom julemanden når han ringer med den bell er vi klar til det hele kører som en well  sidder med min pige (yeah) flower på det beat (yeah) sipper på min lean sipper på min lean (yeah) mig og mine drenge leder efter en pige hvor er min queen vi så blæst i athen  sidder med min pige (yeah) flower på det beat (yeah) sipper på min lean sipper på min lean (yeah) mig og mine drenge leder efter en pige hvor er min queen vi så blæst i athen  de spørger alle sammen hvor jeg fra athen det hvor du kan finde mig ta det som et svar hele det her liv virker lidt bizart men når vi tager herfra lever vi som superstars superstars jbf du ved hvem sodagang overgik dem var pisse nemt nu de glemt rip x fuck fuck dem der skød han var gud nu han død da det lød generationen er død  sidder med min pige (yeah) flower på det beat (yeah) sipper på min lean sipper på min lean (yeah) mig og mine drenge leder efter en pige hvor er min queen vi så blæst i athen  sidder med min pige (yeah) flower på det beat (yeah) sipper på min lean sipper på min lean (yeah) mig og mine drenge leder efter en pige hvor er min queen vi så blæst i athen
