keep the faith, bon jovi, mother mother tell your children that their time has just begun i have suffered for my anger there are wars that can't be won father father please believe me i am layin' down my guns i am broken like an arrow forgive me forgive your wayward son everybody needs somebody to love (mother mother) everybody needs somebody to hate (please believe me) everybody's bitching 'cause they can't get enough and it's hard to hold on when there's no one to lean on  faith you know you're gonna live through the rain lord we've gotta keep the faith faith don't you let your love turn to hate right now we've gotta keep the faith keep the faith keep the faith lord we've gotta keep the faith  tell me baby when i hurt you do you keep it all inside do you tell me all's forgiven and just hide behind your pride yeah everybody needs somebody to love (mother father) everybody needs somebody to hate (please don't leave me) everybody's bleeding 'cause the times are tough well it's hard to be strong when there's no one to dream on  faith you know you're gonna live through the rain lord we've gotta keep the faith faith don't you know it's never too late right now we've gotta keep the faith faith don't you let your love turn to hate lord we've gotta keep the faith keep the faith keep the faith oh we've gotta keep the faith keep the faith keep the faith lord we've gotta keep the faith ooh yeah ooh yeah yeah yeah yeah  i've been walking in the footsteps of society's lies i don't like what i see no more sometimes i wish that i was blind sometimes i wait forever to stand out in the rain so no one sees me crying trying to wash away this pain mother father (everybody needs somebody to love) there's things i've done i can't erase (everybody needs somebody to hate) and every night we fall from grace (everybody's bitching 'cause they can't get enough) it's hard with the world in your face (everybody needs) trying to hold on trying to hold on (everybody keep the faith)  faith you know you're gonna live through the rain lord you gotta keep the faith faith don't you let your love turn to hate right now we've gotta keep the faith keep the faith keep the faith trying to hold on trying to hold on yeah keep the faith keep the faith everybody keep the faith keep the faith keep the faith ooh yeah ooh yeah ooh yeah ooh yeah ooh yeah everybody needs somebody to love (ooh yeah ooh yeah ooh yeah ooh yeah ooh yeah) everybody needs somebody to hate everybody's bitching 'cause they can't get enough everybody needs everybody keep the faith
when we were us, bon jovi, we were young unafraid we were finding our own way there's no wind there's no rain in the eye of a hurricane every time you climb that mountain there's another one left to climb don't go looking for tomorrow leaving yesterday behind  writing every page together those days were not to last forever diamonds in the rough when we were us burn the house and torch the skyline there was more than fire in our eyes love meant more than lust when we were us  we were one born and raised more than blood runs through these veins cuts can heal scars will fade what we had will never change seasons pass and time will move on you don't ever have to let it go you can only go so far now till you're on your way back home  writing every page together those days were not to last forever diamonds in the rough when we were us burn the house and torch the skyline there was more than fire in our eyes love meant more than lust when we were us  memories are nothing more than ghosts that we let in don't be afraid of them do you remember when  writing every page together those days were not to last forever diamonds in the rough when we were us burn the house and torch the skyline there was more than fire in our eyes love meant more than lust when we were us whoa oh oh oh when we were us oh oh oh oh
in these arms, bon jovi, you want commitment take a look into these eyes they burn with fire (yeah) until the end of time and i would do anything i'd beg i'd steal i'd die to have you in these arms tonight baby i want you like the roses want the rain you know i need you like a poet needs the pain i would give anything my blood my love my life if you were in these arms tonight  i'd hold you i'd need you i'd get down on my knees for you and make everything alright if you were in these arms i'd love you i'd please you i'd tell you that i'd never leave you and love you until the end of time if you were in these arms tonight  we stared at the sun and we made a promise a promise this world would never blind us and these were our words our words were our songs our songs are our prayers these prayers keep me strong and i still believe if you were in these arms  i'd hold you i'd need you i'd get down on my knees for you and make everything alright if you were in these arms i'd love you i'd please you i'd tell you that i'd never leave you and love you until the end of time if you were in these arms tonight  your clothes are still scattered all over our room this whole place still smells like your cheap perfume everything here reminds me of you and there's nothing that i wouldn't do and these were our words they keep me strong baby!  i'd hold you i'd need you i'd get down on my knees for you and make everything alright if you were in these arms i'd love you i'd please you i'd tell you that i'd never leave you and love you until the end of time if you were in these arms tonight  if you were in these arms tonight if you were in these arms tonight if you were in these arms baby like the roses need the rain like the seasons need to change like a poet needs the pain i need you in these arms tonight if you were in these arms tonight
shot through the heart, bon jovi, shot through the heart it's all part of the game we call love  would you be content to see me crying after all those little games you put me through after all i've done for you you're lying wouldn't it be nice to tell the truth  didn't somebody somewhere say you're gonna take a fall i gave you everything now here's the curtain call  and i'm shot through the heart as i lay there alone in the dark through the heart it's all part of this game that we call love  now you've come back here to say you're sorry i just don't know who you're talking to it could be the man i used to be girl i've grown up and now i'm over you standing there just a live wire with nowhere left to turn you were gonna set the world on fire but you never learn  that i'm shot through the heart as i lay there alone in the dark through the heart it's all part of this game that we call love  standing there just a live wire with nowhere left to turn you were gonna set the world on fire but you never learn? now you're shot  baby does what baby please and baby must have what she sees but not this time the tables turned and baby you just got burned  shot through the heart as i lay there alone in the dark through the heart it's all part of this game that we call shot through the heart as i lay there alone in the dark through the heart it's all part of this game that we call shot through the heart as i lay there alone in the dark through the heart it's all part of this game that we call love shot shot shot shot shot shot shot shot shot
labor of love, bon jovi, smoke stack blowing there's a fire in the sky fahrenheit rising up higher than high pressure's building up sparks are gonna fly i know where this is going when i look into your eyes i know where this is going when i look into your eyes sweet sweat's rolling down the middle of your spine bodies move together perfect rhythm and time baby say my name i'll write yours in the sky higher than a rocket on the fourth of july higher than a rocket on the fourth of july  it's good it's good it's good to be alive  it's a full time job the work's never done twenty-four seven it's a labor of love you're everything i got it's all about us baby this ain't working it's a labor of love baby this ain't working it's a labor of love  only fools count treasure in silver and gold i don't want for nothing that these hands can't hold if you need something done put it on the list and if i need some sugar i'll get it from your lips if i need some sugar i'll get it from your lips  it's good it's good it's good to be alive  it's a full time job the work's never done twenty-four seven it's a labor of love you're everything i got it's all about us baby this ain't working it's a labor of love baby this ain't working it's a labor of love  the taste of your lips every night every day i know every curve but it's never the same if love is a fire i'd go down in those flames i wanna die in your arms hearing you say my name i wanna die in your arms hearing you say my name i wanna die in your arms hearing you say my name  it's a full time job the work's never done twenty-four seven it's a labor of love you're everything i got it's all about us baby this ain't working it's a labor of love  it's a full time job the work's never done twenty-four seven it's a labor of love give everything i got i can't get enough baby this ain't working it's a labor of love baby this ain't working it's a labor of love
someday i'll be saturday night, bon jovi, hey man i'm alive i'm taking each day and night at a time i'm feeling like a monday but someday i'll be saturday night  hey my name is jim where did i go wrong? my life's a bargain basement and all the good shit's gone just can't hold a job where do i belong? been sleeping in my car my dreams moved on my name is billie jean my love is bought and sold i'm only sixteen i feel a hundred years old my foster daddy went took my innocence away the street life ain't much better but at least i'm getting paid  and tuesday just might go my way can't get worse than yesterday thursdays fridays ain't been kind but somehow i'll survive  hey man i'm alive! i'm taking each day and night at a time yeah i'm down but i know i'll get by hey hey hey hey man gotta live my life like i ain't got nothing but this roll of the dice i'm feeling like a monday but someday i'll be saturday night  now i can't say my name or tell you where i am i want to blow myself away don't know if i can i wish that i could be in some other time and place with someone else's soul someone else's face   hey man i'm alive! i'm taking each day and night at a time yeah i'm down but i know i'll get by hey hey hey hey man i gotta live my life i'm gonna pick up all the pieces and what's left of my pride i'm feeling like a monday but someday i'll be saturday night  someday i'll be saturday night i'll be back on my feet i'll be doing all right it may not be tomorrow baby that's okay i ain't going down i'm gonna find a way!
who says you can't go home?, bon jovi, i spent 20 years trying to get out of this place i was looking for something i couldn't replace i was running away from the only thing i've ever known like a blind dog without a bone i was a gypsy lost in the twilight zone i hijacked a rainbow and crashed into a pot of gold i been there done that and i ain't looking back on the seeds i've sown saving dimes spending too much time on the telephone who says you can't go home  who says you can't go home there's only one place they call me one of their own just a hometown boy born a rolling stone who says you can't go home who says you can't go back been all around the world and as a matter of fact there's only one place left i want to go who says you can't go home it's alright it's alright it's alright it's alright its alright  i went as far as i could i tried to find a new face there isn't one of these lines that i would erase i lived a million miles of memories on that road with every step i take i know that i'm not alone you take the home from the boy but not the boy from his home these are my streets the only life i've ever known who says you can't go home  who says you can't go home there's only one place they call me one of their own just a hometown boy born a rolling stone who says you can't go home who says you can't go back been all around the world and as a matter of fact there's only one place left i want to go who says you can't go home it's alright it's alright it's alright it's alright its alright  i been there done thatand i ain't looking that it's been a long long road feels like i never left that's how the story goes it doesn't matter where you are it doesn't matter where you go if it's a million miles aways or just a mile up the road take it in take it with you when you go who says you can't go home  who says you can't go home there's only one place they call me one of their own just a hometown boy born a rolling stone who says you can't go home who says you can't go back been all around the world and as a matter of fact there's only one place left i want to go who says you can't go home it's alright it's alright it's alright it's alright its alright it's alright it's alright it's alright it's alright its alright who says you can't go home who says you can't go home
misunderstood, bon jovi, should i? could i? have said the wrong things right a thousand times if i could just rewind i see it in my mind if i could turn back time you'd still be mine  you cried i died i should have shut my mouth things headed south as the words slipped off my tongue they sounded dumb if this old heart could talk it'd say you're the one i'm wasting time when i think about it  i should have drove all night i would have run all the lights i was misunderstood i stumbled like my words did the best i could damn misunderstood  could i? should i? apologize for sleeping on the couch that night staying out too late with all my friends you found me passed out in the yard again you cried i tried to stretch the truth but didn't lie it's not so bad when you think about it  i should have drove all night i would have run all the lights i was misunderstood i stumbled like my words did the best i could damn misunderstood intentions good   it's you and i just think about it  i should have drove all night i would have run all the lights i was misunderstood i stumbled like my words did the best i could i 'm hanging outside your door i've been here before misunderstood  i stumbled like my words did the best i could damn misunderstood intentions good
real love, bon jovi, they're putting up the chairs to close she let me settle up my tab i told her button up it's cold i ain't too drunk to hail us a cab we can get a cup of coffee but unless you gotta get back home  sitting across that table a gypsy couldn't read her mind i took her hand and told her i just wanna crawl into her eyes she shook her head and said “it's cruel”; cruel is just a cheap disguise  have you ever known a real love the kind of love that makes you feel love no this ain't let's make a deal love make an angel give his wings up it makes you guilty cause you want more if it's a kiss that you would die for feels like you're falling through the stars if it could break your heart it's real love  we drank that muddy pot of coffee it was morning when i walked her home i've never been this lonely lying in this bed alone her words still ringing in my head her sad eyes sunk me like a stone  have you ever known a real love? the kind of love that makes you feel love? no this ain't let's make a deal love make an angel give his wings up it makes you guilty 'cause you want more if it's a kiss that you would die for feels like you're falling through the stars if it can break your heart it's real love  i put on that same shirt and i ran out the door stole a fistful of roses from the sidewalk store with just my heart in my hand i had nothing to prove standing up on her front steps calling to her window  have you ever known a real love? the kind of love that makes you feel love? no this ain't let's make a deal love make an angel give his wings up it makes you guilty 'cause you want more if it's a kiss that you will die for feels like you're falling through the stars if it can break your heart it's real love  feels like you're falling through the stars if it can break your heart it's real love
knockout, bon jovi, everyday i wake up with my back against the wall anytime you get up someone wants to see you fall if you're afraid to lose it all you're never gonna win  i'll be giving you the finger sticking out my chin boom boom boom here comes the boom boom boom  here comes the knockout my time is right now turning your lights out i'm throwing down here comes the knockout until the last round i'm throwing down go start a fire go start a fight no regrets this is your life (hey!) here comes the knockout my time is right now i'm throwing down  are you living in a nightmare? are you living in a dream? do you stand for something? will you fall for anything? it's easier to count me out but you can count me in  'cause i'm giving you the finger and sticking out my chin boom boom boom here comes the boom boom boom  here comes the knockout my time is right now turning your lights out i'm throwing down here comes the knockout until the last round i'm throwing down go start a fire go start a fight no regrets this is your life (hey!) here comes the knockout my time is right now i'm throwing down down down down down throwing down down down down down  did you really live your life or did it pass you by? what's it take to tell yourself you really were alive look me in the eye  here comes the knockout my time is right now turning your lights out i'm throwing down here comes the knockout until the last round i'm throwing down go start a fire go start a fight no regrets this is your life (hey!) here comes the knockout my time is right now i'm throwing down
we weren't born to follow, bon jovi, this one goes out to the man who mines for miracles this one goes out to the ones in need this one goes out to the sinner and the cynical this ain't about no apology this road was paved by the hopeless and the hungry this road was paved by the winds of change walking beside the guilty and the innocent how will you raise your hand when they call your name? yeah yeah yeah  we weren't born to follow come on and get up off your knees when life is a bitter pill to swallow you gotta hold on to what you believe believe that the sun will shine tomorrow and that your saints and sinners bleed we weren't born to follow you gotta stand up for what you believe let me hear you say yeah yeah yeah oh yeah this one's about anyone who does it differently this one's about the one who cusses and spits this ain't about our livin' in a fantasy this ain't about givin' up or givin' in yeah yeah yeah  we weren't born to follow come on and get up off your knees when life is a bitter pill to swallow you gotta hold on to what you believe believe that the sun will shine tomorrow and that your saints and sinners bleed we weren't born to follow you gotta stand up for what you believe let me hear you say yeah yeah yeah oh yeah  we weren't born to follow come on and get up off your knees when life is a bitter pill to swallow you gotta hold on to what you believe believe that the sun will shine tomorrow and that your saints and sinners bleed we weren't born to follow you gotta stand up for what you believe let me hear you say yeah yeah yeah oh yeah  we weren't born to follow - oh yeah we weren't born to follow - oh yeah
(you want to) make a memory, bon jovi, hello again it’s you and me kinda always like it used to be sipping wine killing time tryna' to solve life’s mysteries how’s your life? it’s been a while god it’s good to see you smile i see you reaching for your keys looking for a reason not to leave  if you don’t know if you should stay if you don’t say what’s on your mind baby just breathe there’s no where else tonight we should be- you wanna make a memory  i dug up this old photograph look at all that hair we had it’s bittersweet to hear you laugh your phone is ringing i don’t wanna ask  if you go now i’ll understand if you stay hey i got a plan  you wanna make a memory? you wanna steal a piece of time? you could sing a melody to me and i could write a couple lines you wanna make a memory  if you don’t know if you should stay and you don’t say what’s on your mind baby just breathe there’s no where else tonight we should be- (we shouldn't be) we should be you wanna make a memory? you wanna steal a piece of time? you can sing the melody to me and i could write a couple lines you wanna make a memory you wanna make a memory
lay your hands on me, bon jovi, if you're ready i'm willing and able help me lay my cards out on the table you're mine and i'm yours for the taking right now the rules we made are meant for breaking what you get ain't always what you see but satisfaction's guaranteed they say what you give is always what you need so if you want me to lay my hands on you  lay your hands on me   i'm a fighter i'm a poet i'm a preacher i've been to school and baby i've been the teacher if you show me how to get up off the ground i can show you how to fly and never ever come back down everything you want is what i need satisfaction's guaranteed but the ride don't never ever come for free if you want me to lay my hands on you   don't you know i only aim to please if you want me to lay my hands on you lay your hands on me
reunion, bon jovi, this isn't how the story ends my friends it's just a fork along the road don't say your prayers save your amens you've come this far but you're still far from home don't say goodbye just say farewell write every line you'll live to tell hold your head high like harry give 'em hell as the night ignites the day make some memories along the way hey  write your song sing along love your life learn to laugh dare to dance touch the sky take pictures each step of the way make this the best of the rest of your days start your revolution and i'll see you at the reunion  some friends will go and some will stay okay some last a chapter some a page for some love comes disguised as lust but you'll find love when you find trust one day do better than our parents did imperfect husband wife and kids go chart your course then turn it upside down go live your life eyes open wide who's to say what's wrong or right right?  write your song sing along love your life learn to laugh dare to dance touch the sky take pictures each step of the way make this the best of the rest of your days start your revolution and i'll see you at the reunion oh  as the night ignites the day go make some memories along the way  write your song sing along love your life yeah learn to laugh dare to dance touch the sky take pictures each step of the way make this the best of the rest of your days i say go start your own revolution and i'll see you at the reunion i'll see you at the reunion oh i'll see you at the reunion  this isn't how the story ends my friends it's just a fork along the road
because we can, bon jovi, i don't wanna be another wave in the ocean i am a rock not just another grain of sand i wanna be the one you run to when you need a shoulder i ain't a soldier but i'm here to take a stand because we can  she's in the kitchen staring out the window so tired of living life in black and white right now she's missing those technicolor kisses when he turns down the lights lately he's feeling like a broken promise in the mirror staring down his doubt there's only one thing in this world that he knows he said forever and he'll never let her down   tv and takeout on the coffee table paper dishes pour a glass of wine turn down the sound and move a little closer and for the moment everything is alright   because we can our love can move a mountain we can if you believe in we we can just wrap your arms around me we can we can
born again tomorrow, bon jovi, if you were born again tomorrow (born again tomorrow)  this ain't a test no it's a warning ain't gonna say the sky is falling you gotta read between the lines stop waiting for a sign who's gonna live your life?  yeah you don't have to look back to see where we are the future's looking brighter than a handful of stars you gotta hold on hold on be strong  if you were born again tomorrow would you live your life like yesterday? if you were born again tomorrow i wouldn't live my life any other way  don't have to end up where you started heaven loves the broken hearted you learn from your mistakes bones grow stronger where they break who says that scars don't fade?  yeah you don't have to look back to see where we are the future's looking brighter than a handful of stars you gotta hold on hold on you gotta be strong  if you were born again tomorrow would you live your life like yesterday? if you were born again tomorrow i wouldn't live my life any other way  would you relive every moment? would you tear out any page? if you were born again tomorrow i wouldn't live my life any other way any other way hey hey hey any other way hey  if you were born again tomorrow would you live your life like yesterday? if you were born again tomorrow i wouldn't live my life any other way  would you relive every moment? would you tear out any page? if you were born again tomorrow i wouldn't live my life any other way  any other way (born again tomorrow) if you were born again tomorrow (born again tomorrow)
